{
  "schema": "mdoc-circuits-v1.schema.json",
  "system": "longfellow-libzk-v1",
  "sha256": "e3b0c44298fc1c149afbf4c8996fb92427ae41e4649b934ca495991b7852b855",
  "version": 6,
  "num_attributes": 1,
  "provenance": {
    "type": "repository",
    "repo": "github.com/example/fixtures",
    "ref": "abababababababababababababababababababab",
    "path": "circuits/tiny.circuit"
  },
  "comment": "Circuit vector for the loader tests, at version 6 over one attribute. Its blob is empty; provenance carries index and via."
}
