{
  "schema": "mdoc-circuits-v1.schema.json",
  "system": "longfellow-libzk-v1",
  "sha256": "deb83076b7300d94f18e287e3fe4705823074979165ad08645c97a93c0363968",
  "version": 7,
  "num_attributes": 2,
  "provenance": {
    "type": "repository",
    "repo": "github.com/google/longfellow-zk",
    "ref": "fe83ec6c4efa5f98bc2439c8b06e5eccd153aca0",
    "path": "lib/circuits/mdoc/circuits/6a5810683e62b6d7766ebd0d7ca72518a2b8325418142adcadb10d51dbbcd5ad"
  }
}
