{
  "schema": "mdoc-circuits-v1.schema.json",
  "system": "longfellow-libzk-v1",
  "sha256": "9999999999999999999999999999999999999999999999999999999999999999",
  "version": 6,
  "num_attributes": 1,
  "provenance": {
    "type": "constructed",
    "generator": "fixture"
  },
  "comment": "Circuit vector whose blob file is absent."
}
