{
  "schema": "mdoc-circuits-v1.schema.json",
  "system": "longfellow-libzk-v1",
  "sha256": "9016d173d8a579a104591b85826798bfbb03eafa7b376ad18c5344eab3a92769",
  "version": 7,
  "num_attributes": 1,
  "provenance": {
    "type": "repository",
    "repo": "github.com/google/longfellow-zk",
    "ref": "fe83ec6c4efa5f98bc2439c8b06e5eccd153aca0",
    "path": "lib/circuits/mdoc/circuits/8d079211715200ff06c5109639245502bfe94aa869908d31176aae4016182121"
  }
}
